Job ID,Job URL,Job Title,Company Name,Status,Timestamp,WP ID
550c0bc17a1bdb8e,https://ws.linkedin.com/jobs/view/samoa-maintenance-technician-savaii-at-the-church-of-jesus-christ-of-latter-day-saints-4426613925,Samoa: Maintenance Technician (Savaii),The Church of Jesus Christ of Latter-day Saints,posted,2026-07-07T01:36:03.092762,17
92dba80a59629b0f,https://ws.linkedin.com/jobs/view/editor-at-samoa-observer-4433914084,Editor,Samoa Observer,posted,2026-07-07T01:36:27.543358,19
58d720bfba90de49,https://ws.linkedin.com/jobs/view/senior-container-cleaning-officer-at-neptune-pacific-direct-line-4432341175,Senior Container Cleaning Officer,,scraped,2026-07-07T01:36:29.967922,
81396db900688b6f,https://ws.linkedin.com/jobs/view/un-women-communications-analyst-n-ppsa-8-apia-samoa-open-to-samoa-nationals-only-at-un-women-4436160311,"UN Women: Communications Analyst, N-PPSA 8, Apia, SAMOA (Open to Samoa Nationals ONLY)",UN Women,posted,2026-07-07T01:36:59.103634,21
4e045b01adc042ee,https://ws.linkedin.com/jobs/view/request-for-proposals-public-enterprise-governance-specialists-at-dt-global-4427470795,Request for Proposals: Public Enterprise Governance Specialists,,scraped,2026-07-07T01:37:01.587876,
600b06d031a17ab9,https://ws.linkedin.com/jobs/view/samoa-on-call-sub-food-service-lead-cook-church-college-vaiola-at-the-church-of-jesus-christ-of-latter-day-saints-4434675808,SAMOA: On-call Sub Food Service Lead (Cook) - Church College Vaiola,The Church of Jesus Christ of Latter-day Saints,posted,2026-07-07T01:37:27.676271,23
